{"entry":"solution","initial_hash":"0fcdba84e2ad6b99a84ae8286047f4a88ecfe6d664e747f735a3cf0b23c04406","normal_form":["pair",["or",["var",0],["var",2]],["and",["var",1],["var",3]]],"rows":[{"a":[1,0],"b":[1,0],"exact":[0],"optimal":true,"out":[1,0],"sound":true},{"a":[1,0],"b":[0,1],"exact":[0],"optimal":true,"out":[1,0],"sound":true},{"a":[1,0],"b":[0,0],"exact":[0],"optimal":true,"out":[1,0],"sound":true},{"a":[0,1],"b":[1,0],"exact":[0],"optimal":true,"out":[1,0],"sound":true},{"a":[0,1],"b":[0,1],"exact":[1],"optimal":true,"out":[0,1],"sound":true},{"a":[0,1],"b":[0,0],"exact":[0,1],"optimal":true,"out":[0,0],"sound":true},{"a":[0,0],"b":[1,0],"exact":[0],"optimal":true,"out":[1,0],"sound":true},{"a":[0,0],"b":[0,1],"exact":[0,1],"optimal":true,"out":[0,0],"sound":true},{"a":[0,0],"b":[0,0],"exact":[0,1],"optimal":true,"out":[0,0],"sound":true}],"schema":"qkf-rewrite-v3","semantics":"total-transfer-words-v2; positive-width; modular-arithmetic; SMT-total-div-shift; standard-counts; nonbottom-KB","sources":{"program":"515485ef73decd20c038316b871bab3d3603f384821f71e0e2f2ac176abe43d1"},"steps":[{"path":[1,1],"rule":"set-leading-included"},{"path":[1,2],"rule":"set-leading-included"},{"path":[1],"rule":"idempotent"}],"target":"and"}
